"Intelligent manufacturing is now a reality, and the advances we announced today spanning end-to-end IoT security, d‰Û_ https://t.co/kSIZL3km1C"
"RT @MSFTResearch: The 2018 ACM A.M. Turing Award was awarded to Yoshua Bengio, a Microsoft Research Montreal collaborator, Geoffrey Hinton‰Û_"
Great to be with Adobe CEO Shantanu Narayen at #AdobeSummit this morning to share an update on how the Open Data In‰Û_ https://t.co/jFFGqL14DK
RT @MSCloud: We're continuing to expand our #Azure Stack offerings and delivering more innovation at the edge. Read about our Azure Stack u‰Û_
"I recently talked to SÌüren Skou, CEO of @Maersk, the world‰Ûªs largest container shipping company, and he shared less‰Û_ https://t.co/Hezlq5Qgzj"
"RT @Adobe: We're excited to extend our partnership with @Microsoft and @LinkedIn, accelerating Account-Based Experiences: https://t.co/91YT‰Û_"
"RT @MSFT365news: Introducing new @Microsoft365 enhancements to help IT reduce costs, increase security, and boost employee productivity. #M‰Û_"
"Our #HackingSTEM team offers teachers free, hands-on lesson plans that teach critical skills, like problem-solving,‰Û_ https://t.co/wvFVycpAkp"
Partnering with Renault-Nissan-Mitsubishi Alliance to apply the power of Azure to fuel new connected car services i‰Û_ https://t.co/svgQML9rA5
"Today we introduced new capabilities to make collaboration more inclusive and intelligent, while delivering new lev‰Û_ https://t.co/RAOdMbB7jx"
Hate and violence have no place in our society. We mourn all the victims of the horrific attack in New Zealand incl‰Û_ https://t.co/cCIp2EPSv0
Great to see I Promise School at the forefront of equipping students with skills they need to thrive in any career‰Û_ https://t.co/aCjyQ61wKn
"Announcing Microsoft Game Stack, a new initiative bringing together tools and services ‰ÛÒ from Azure and App Center‰Û_ https://t.co/QhfG8nSOrn"
"RT @ToniTWhitley: With today‰Ûªs @Microsoft_Gov announcements, we are deepening our support of government across all branches and levels, ena‰Û_"
RT @jennylayfluffy: Achieving big goals takes partnership. Humbled to partner with so many amazing folks and organizations to work and driv‰Û_
"Ann frames so well why we must collectively address this challenge: ""Our teams need to be as diverse as the problem‰Û_ https://t.co/xTuQh2yOzz"
"RT @BillGates: I was lucky to be a young person when the digital revolution was just getting under way, and my Microsoft colleagues and I h‰Û_"
"I sat down with Kaiser Permanente CEO @BernardJTyson recently, and we chatted about how technology is rapidly trans‰Û_ https://t.co/HbAx4qojzw"
"RT @BradSmi: How do we design, build, and use #AI to create a positive impact on society? These are the crucial questions business leaders‰Û_"
"RT @Microsoft: For #InternationalWomensDay, learn about STEM pioneers that built the foundation for the next generation. Visit: https://t.c‰Û_"
I had the chance to sit down with Volkswagen CEO Herbert Diess in Berlin last week to talk about our partnership to‰Û_ https://t.co/1gEydTKpd8
"This #InternationalWomensDay, we're celebrating the incredible contributions of women to our industry and also work‰Û_ https://t.co/lhah1akVKV"
RT @yusuf_i_mehdi: Thank you to all our customers and partners for helping us achieve 800 million #Windows10 devices and the highest custom‰Û_
"We‰Ûªre committed to creating new opportunity for people and organizations across Africa, becoming the first global p‰Û_ https://t.co/fmULcYaOJR"
"I enjoyed talking to Dr. Dieter Zetsche, chairman of @Daimler, about his vision for the future of the auto industry‰Û_ https://t.co/mJWn7afZFI"
Fantastic to see @PlutonForEver on 60 Minutes last night discussing the importance of STEM education for girls. Bon‰Û_ https://t.co/SXJv42XV7v
"This week, I talked to @Telefonica CEO @jmalvpal about how his company is putting AI at the center of its business‰Û_ https://t.co/UN0g0iU7MM"
"Cybersecurity is a central challenge, and we are committed to helping keep everyone safe from the latest threats. O‰Û_ https://t.co/7YKfZVq8HB"
Partnering with Volkswagen to deliver new Azure-based services that drive innovation in connected cars and define t‰Û_ https://t.co/soDbsx6MG8
"A look at how our Dynamics 365 mixed reality apps, when paired with HoloLens 2, empower workers everywhere, making‰Û_ https://t.co/XKWvbxZq9H"
"Together with TelefÌ_nica, we are applying the power of Azure and Azure AI to create new, innovative experiences for‰Û_ https://t.co/KHbSwqiTZO"
"Our collective opportunity in this era of the intelligent cloud and intelligent edge has never been greater, and wi‰Û_ https://t.co/DJLcCwNPhI"
"RT @Microsoft: Join us Sunday, February 24, at 6PM CET/9AM PT to learn about new innovations for the future of computing: https://t.co/U3dz‰Û_"
RT @Microsoft: #Cloud-based innovations help @Albertsons make shopping faster and easier for its 35 million weekly customers: https://t.co/‰Û_
"During #BlackHistoryMonth, colleagues across Microsoft are sharing how ""one small act"" helped define who they are t‰Û_ https://t.co/M80r2ao4X2"
We‰Ûªre bringing new AI and mixed reality capabilities to Dynamics 365 to help organizations unlock new insights from‰Û_ https://t.co/ud83VdZrnM
"Together with Daimler, we‰Ûªre applying the power of Azure to convert massive amounts of data into insights that will‰Û_ https://t.co/WV6L8LlC55"
"As we celebrate #BlackHistoryMonth, we also recognize the 30th anniversary of our Blacks at Microsoft community. As‰Û_ https://t.co/7OKEhKlwCd"
"RT @arunulag: Gartner calls out #PowerBI's leadership in latest MQ - deeply grateful to our customers, community, and partners, and to the‰Û_"
"RT @MicrosoftWomen: Happy International Day of Women and Girls in Science!  Today we celebrate the incredible contributions to science fr‰Û_"
"We have an enormous opportunity to apply advances in cloud &amp; AI to provide more personal, affordable and accessible‰Û_ https://t.co/1cFBL5Ix9B"
"RT @Microsoft: _ÙÕ_ Imagine_ÙèÑ•üè Create‰Î¬•üè CodeMicrosoft Build is a go.Join us in Seattle from May 6-8: https://t.co/KYm5nAbyt9 #MSBuild"
"Microsoft has always been a partner-led company, and we are committed to creating more opportunity for our partners‰Û_ https://t.co/ppLcgSJmjc"
"RT @judsonalthoff: Big news: Today's launch of the Accenture Microsoft Business Group, the next step in our @Accenture &amp; @AvanadeInc partne‰Û_"
Deeply saddened to learn of the passing of Pierre Nanterme. Pierre was a friend and visionary leader who drove the‰Û_ https://t.co/3XeBJ8GReI
Empowering every gamer of every ability to play the games they love https://t.co/plQdzCSydN
"With our Power Platform, we are enabling anyone with a big idea and the passion to make a difference to maximize th‰Û_ https://t.co/uKqjCLERpD"
"From Walmart to Mastercard to ZF, it‰Ûªs fantastic to see how organizations across industries are building digital ca‰Û_ https://t.co/hD2JNnkaDo"
"Today we are welcoming Citus Data to Microsoft, building on our commitments to make Azure the most comprehensive cl‰Û_ https://t.co/93o97kRXBH"
Across Microsoft ‰ÛÒ from Teams and Flipgrid to Surface and Mixed Reality ‰ÛÒ we are working to empower every student a‰Û_ https://t.co/4w7ERImAM1
Today we celebrate the incredible life and legacy of Dr. Martin Luther King Jr. I hope Dr. King‰Ûªs work inspires eac‰Û_ https://t.co/HhWcDPINcj
The necessity of tech intensity in today‰Ûªs digital world https://t.co/hJFmfcF1I2
The Puget Sound is Microsoft‰Ûªs home and we believe everyone who works here ‰ÛÒ our employees &amp; partners and all those‰Û_ https://t.co/Pk5USHIN97
"Together with Walgreens Boots Alliance we aim to put people at the center of their health &amp; wellness, combining the‰Û_ https://t.co/kk0jypAoHF"
Introducing new capabilities in Microsoft Teams to empower the more than 2 billion firstline workers around the wor‰Û_ https://t.co/rFqQ4j7q8K
"RT @Windows: When everything‰Ûªs talking, it‰Ûªs easier to make connections. See how the intelligent edge is bringing millions of devices toget‰Û_"
"RT @BradSmi: Not another Top 10 list! Today, I‰Ûªm looking back at the hot-button tech issues from 2018, and thinking about how they‰Ûªll impac‰Û_"
"Together with Kroger, we are applying the power of Azure and Azure AI to redefine the shopping experience for milli‰Û_ https://t.co/qQQDPFgBWC"
"RT @jennylayfluffy: Steve, you‰Ûªre a humble force of nature who deserves this and so much more. You‰Ûªve changed the face of ALS &amp; disability.‰Û_"
"Congratulations, Bonnie! What a well-deserved honor. Your passion, creativity and commitment to STEM is an inspirat‰Û_ https://t.co/dUmtm1kumU"
10 change-makers who inspired me in 2018 https://t.co/kQt8nBVCjF
"With the team at BlackRock, we‰Ûªre applying the power of the cloud and AI to reimagine retirement planning. https://t.co/JuKFBNehAy"
We need to level the playing field so companies receiving funding are a truer reflection of the world in which we l‰Û_ https://t.co/RhdrboGih0
RT @BradSmi: Today is the first anniversary of Microsoft‰Ûªs #AIforEarth initiative. I‰Ûªm always impressed by our grantees‰Ûª incredible work. T‰Û_
RT @Microsoft: Data tells @FruitOfTheLoom when it's time to stock the shelves. Learn how they draw insights: https://t.co/ZxMToD1ur1 _Ùçà_Ùç_
"We've seen how AI can be applied for good, but we must also guard against its unintended consequences. Now is the t‰Û_ https://t.co/lgcMiTNLdU"
It was delightful to visit the Starbucks Signing Store in D.C. today and meet some of the partners there. What an i‰Û_ https://t.co/L4FsWrkxae
"It‰Ûªs #CSEdWeek, and this morning I met with students and teachers from Brooklyn and the Bronx, who shared with me t‰Û_ https://t.co/UmAQMtDSjw"
"The rural broadband gap is an urgent national problem that must be solved, and we are committed to doing our part t‰Û_ https://t.co/tad8u5z08b"
"A powerful example of how teaching computer science can change how students approach learning ‰ÛÒ and, in the process‰Û_ https://t.co/jQQcNBfppJ"
"RT @jennylayfluffy: Today is @UN International Day of Persons with Disability. The focus is  building an inclusive equitable world, that is‰Û_"
RT @MicrosoftEDU: #CSEdWeek has arrived and we couldn't be more excited to dive in. We hope you'll follow along and gather some inspiration‰Û_
"Each of us needs a digital identity we control, which provides us a secure, instant way to verify our identity with‰Û_ https://t.co/r0gptnkGFM"
George H.W. Bush will be remembered for his dedicated service and leadership to our country. My thoughts are with h‰Û_ https://t.co/URxfU0gMQd
"RT @Microsoft: When everybody plays, we all win. https://t.co/ArblvlwCHI https://t.co/rfQEEguYqp"
RT @MSFTBlockchain: Build and deploy end-to-end #blockchain apps using the best of Microsoft and Azure with the new #AzureBlockchain Develo‰Û_
"This year‰Ûªs #skypeathon brought together students and teachers from more than 100 countries, traveling nearly 24M v‰Û_ https://t.co/ZIxoXXPxgU"
"RT @XboxP3: One of TIME's 50 best inventions of 2018  - the Xbox Adaptive Controller - Wow, very cool recognition of the team's work. https‰Û_"
RT @Microsoft: Most companies say they want to use #AI. Learn how we're making it possible: https://t.co/faPa4Sds47
"From Antwerp to Denver to Espoo to Houston, we‰Ûªre working with cities around the world to apply technology to tackl‰Û_ https://t.co/0X5wI9hJ1w"
"The Paris Call for Trust and Security in Cyberspace is an important step on the path toward digital peace, creating‰Û_ https://t.co/GyDHveuMxI"
"Happy Veterans Day and thank you to all those who have served our country, we owe so much to your service and sacri‰Û_ https://t.co/Difr3porWp"
"RT @geekwire: #Microsoft is supporting a five-year effort by @AnswerALS with $1M in cloud computing and technical services.‰ÛÏThis is using‰Û_"
"We need to protect the people, organizations, and communities who depend on the digital world. You can help by sign‰Û_ https://t.co/iiCuZqQGGa"
"Centrica is defining the future of field operations, applying the power of Azure and Dynamics 365 to transform the‰Û_ https://t.co/EjkmoyaMJe"
"A great example of how technology can empower people with disabilities, inspired by and built in collaboration with‰Û_ https://t.co/3sjMkv6XnG"
Learn how the Microsoft Soundscape app enables anyone ‰ÛÒ including people who are blind or with low vision ‰ÛÒ to hear‰Û_ https://t.co/V8YoRVBlta
"I‰Ûªm thrilled to welcome GitHub to Microsoft. Together, we will continue to advance GitHub as a platform loved by de‰Û_ https://t.co/pQMvUsPl49"
"This week I‰Ûªm sharing how our Xbox Adaptive Controller was designed for ‰ÛÒ  and with ‰ÛÒ gamers with limited mobility,‰Û_ https://t.co/FeJeEjKMKY"
RT @judsonalthoff: .@AlyTay1 describes the intersection of technology &amp; financial services and how new solutions help #finserv orgs compete‰Û_
"@YuanqingYang Thank you for having me, YY. Always a pleasure to connect with you and the Lenovo team."
RT @panos_panay: Today you can buy Surface Pro 6 and Surface Laptop 2. Products designed to get you into your flow and help you create what‰Û_
Our progress and opportunity ahead https://t.co/CbnmcoRYRP
RT @Microsoft: Statement from Microsoft CEO Satya Nadella on the passing of Paul Allen: https://t.co/1iLDLenLKz
"We‰Ûªre inspired to see how Microsoft 365 Learning Tools is empowering people with dyslexia, and today we signed the‰Û_ https://t.co/nLxgz4nn6A"
"Bringing the power of Azure, AI and Azure Sphere to cricket, transforming how the game is played, coached and watch‰Û_ https://t.co/QqArPP9pCA"
Seeing AI is an example of how AI can transform everyday life for people with disabilities. The app narrates the wo‰Û_ https://t.co/2YrWRDZ7Du
"Announcing Project xCloud game-streaming, to put gamers at the center of their gaming experience, on whatever devic‰Û_ https://t.co/TdboYZeNR2"
"RT @panos_panay: Everything we do, all the choices we make, our commitment to every detail, every radius, every key, it's all about helping‰Û_"
RT @MSFTChicago: The City of Chicago will be the first to pilot the @SmartCityA11y Digital Inclusion Maturity Model to empower people with‰Û_
"RT @yusuf_i_mehdi: Today we shared our vision for a new era of personal productivity; unveiled #SurfacePro6, #SurfaceLaptop2, #SurfaceStudi‰Û_"
Celebrating National Disability Employment Awareness Month with a look at how technology can be applied to empower‰Û_ https://t.co/jCMsPp0JuL
"Paul, All of us at Microsoft are standing with you and are here to lend you strength in all the days ahead. https://t.co/xWnQE09uDW"
Nine billion MCU-based IoT devices ship each year and are rapidly becoming connected ‰ÛÒ from washing machines to chi‰Û_ https://t.co/Ko19w2lTW4
Partnering with Volkswagen to accelerate their digital transformation and drive new innovation https://t.co/pBrZlirJRM
RT @Microsoft: .@Chevron is improving their performance and speed of global collaboration by leveraging #mixedreality applications for firs‰Û_
Announcing new AI and mixed reality business apps for Microsoft Dynamics 365 https://t.co/lUDsOU9NyR
Combining the power of Azure and Mastercard‰Ûªs payment network to define the future of business-to-business transact‰Û_ https://t.co/k6kYqzhFZt
"Otto Knoke, who lives with ALS, is pioneering the use of Eye Control and has regained his independence because of i‰Û_ https://t.co/W7Jd3Eo7P9"
BMW is transforming how people interact with their cars with Microsoft Azure and AI https://t.co/cyqMyO6r9y
"RT @XboxWire: The first-of-its-kind #XboxAdaptiveController will be available starting today, so even more gamers from around the world can‰Û_"
A look at how we‰Ûªre democratizing game development with our PlayFab platform https://t.co/InOTS46zSd
RT @BradSmi: The people who work for us are critical to Microsoft‰Ûªs success. That‰Ûªs why we are extending paid parental leave to the individ‰Û_
RT @BradSmi: It‰Ûªs clear that we all need to do more to help protect democracies from cyberthreats. That‰Ûªs why we are expanding our Defendin‰Û_
"RT @peteratmsr: Making health data interoperable will make all of us healthier. @Microsoft is pleased to join Amazon, Google, and others to‰Û_"
"RT @MSFT_Military: Enabling and enhancing the ability to provide the best care and service to #Veterans, @MICROSOFT and @DeptVetAffairs are‰Û_"
Together with @JDASoftware and @GirishRishiJDA we'll empower more customers to digitally transform their supply cha‰Û_ https://t.co/IaN6GYGuzw
It was a pleasure to sit down with Olympic snowboarding gold medalist @ChloeKim. Learn how she turns obstacles into‰Û_ https://t.co/M2DxrzKhxR
"Banneker High School students Mikayla Sharrieff, Bria Snell and India Skinner are well on their way to changing the‰Û_ https://t.co/wJE9lysGA6"
"@amcauce Well said, @amcauce Thank you for joining us at Microsoft to share your views and experiences in this important conversation."
@TinaBrownLM @FordFoundation @darrenwalker @amcauce @UW @ArlanWasHere @Backstage_Cap @6Gems @BlackGirlsCode Thank y‰Û_ https://t.co/JqHgxY0uEM
@ArlanWasHere @Microsoft @6Gems @amcauce @TinaBrownLM @darrenwalker @Backstage_Cap Thanks for visiting us at Micros‰Û_ https://t.co/a9dPPQxLpB
"Computer science education should be accessible to young people of all backgrounds, which is why we're partnering w‰Û_ https://t.co/7TedqfJONj"
"We want to ensure capital is available more broadly in society, and that must include more women entrepreneurs. Tod‰Û_ https://t.co/NnDNVEPndS"
"@ChloeKim @Microsoft Thanks for joining us at Imagine Cup today, @ChloeKim - your story and lessons learned on and‰Û_ https://t.co/6k78dBdlL7"
"Congratulations to the 2018 Imagine Cup World Champions, team smartARM of Canada, and to every team who participate‰Û_ https://t.co/ZdAwp8vohr"
How the Xbox Adaptive Controller is making gaming more accessible ‰ÛÒ starting with the packaging. https://t.co/NJd048fmYB
Thanks for joining our Hackathon @JussieSmollett - excited to see the impact of the team's #HackforAfrica project! https://t.co/UEdyNKCLji
The inside story of two hackathon teams and how what started as hack projects became two products that have empower‰Û_ https://t.co/pvA21xB4CF
Thrilled to partner with the Walmart team to accelerate their digital transformation. Together we will empower mill‰Û_ https://t.co/eBNHvG2hkq
RT @guardian: How Minecraft is helping kids fall in love with books https://t.co/s5HlihuqG7
"Announcing new updates to Microsoft Teamshttps://t.co/msCG71HnXC"
"RT @surface: Ready. Set. Go! Meet the all new Surface Go. For travel, home, family‰Û_for you. https://t.co/Y5YBfeUAoK"
RT @BradSmi: Andy is a world-class runner and one of our valued employees at the @Microsoft cafÌ©. Good luck this week Andy! We're rooting f‰Û_
"Announcing Microsoft Healthcare, a new initiative with a visionary team, as we work to harness the power of health‰Û_ https://t.co/q11Vlch3o2"
Combining the power of Microsoft Azure with InMobi‰Ûªs marketing platforms to deliver new intelligent customer experi‰Û_ https://t.co/kBw5WiOA9H
Patrick Winter was a visionary leader and force of nature in our industry. My deepest condolences to his family and‰Û_ https://t.co/4zovQJRw5Q
"Each year, Imagine Cup shows what‰Ûªs possible when students come together to apply technology to help solve the worl‰Û_ https://t.co/XG2ezzSDqk"
My views on U.S. immigration policy https://t.co/AZ84yWhFmR
"It was great speaking with Carlos Ghosn, Chairman and CEO of the Renault-Nissan-Mitsubishi Alliance, about his lead‰Û_ https://t.co/rOIhK0zoNY"
Thrilled to welcome @Flipgrid to Microsoft! https://t.co/qdQH5LYkQM
RT @BradSmi: Father's Day is a day we shouldn't take for granted - it's a special day set aside for families to be together. And given the‰Û_
"An inspiring example of how technology can truly empower everyone. With tools like the Immersive Reader, millions o‰Û_ https://t.co/EfYvrxdtfB"
RT @XboxWire: Relive all the exciting moments from yesterday‰Ûªs Xbox E3 Briefing here on Xbox Wire. https://t.co/PprjYWqRHa #E32018
"RT @Microsoft: This week at Computex, we gave a preview of what's possible in the new computing era of the intelligent edge. https://t.co/V‰Û_"
"RT @peteratmsr: As the fog clears off the northern Scottish coast, Microsoft's Project Natick enters a new #research phase operating on the‰Û_"
Microsoft + GitHub = Empowering Developers https://t.co/KqLacgODdk
Proud of all our employees who support and advocate for equal rights and inclusion as we celebrate #Pride2018 https://t.co/e5lY6wfsyf
RT @chriscapossela: Inspiring couple of days @Microsoft‰Ûªs Ability Summit this week! We're discussing the importance of putting #Inclusion a‰Û_
"@EmmanuelMacron Thank you for hosting us at #TechforGood, inspired by our conversation and your vision for how tech‰Û_ https://t.co/Xpw7PGUmPo"
RT @BradSmi: We've awarded 112 #AIforEarth grants in 27 countries. It‰Ûªs great to see this momentum building around AI &amp; its potential to so‰Û_
@EmmanuelMacron Honored to join the #TechforGood Summit with @EmmanuelMacron. Collectively we have a responsibility‰Û_ https://t.co/by6oXRokN6
"As we celebrate Global Accessibility Awareness Day, today we announced the Xbox Adaptive Controller, which will mak‰Û_ https://t.co/DuNvTf7ZnM"
"RT @panos_panay: Meet Surface Hub 2. A new generation, purpose built for dynamic collaboration. #SurfaceHub2 https://t.co/TlDZl7xaZQ"
"It was fantastic to meet the youngest #MSBuild attendees this week, 14-year-old Ruby Cogan and sisters Disa and Ann‰Û_ https://t.co/q57lEQ4m8K"
RT @MicrosoftEDU: Happy #TeacherAppreciationDay to all our education heroes around the world. Make sure to stop and #ThankaTeacher today! h‰Û_
Opportunity and responsibility in the era of the Intelligent Cloud and Intelligent Edge https://t.co/I3KTW0c1Ri
RT @Microsoft: We believe technology can empower everyone to achieve more. #MSBuild #AIForAccessibility https://t.co/THKz9z8mVG
RT @Qualcomm: Learn how we‰Ûªre joining forces with @Microsoft to help developers bring advanced #AI to #IoT devices. _ÙÒá #MSBuild
RT @DJIEnterprise: #DJI and @Microsoft have announced a strategic partnership to bring advanced AI and machine learning capabilities to #DJ‰Û_
See you here at 8:30 PT tomorrow morning #MSBuild https://t.co/HxoB9eC69P https://t.co/5SECcbIla9
"Mikayla, India and Bria, I‰Ûªm inspired by you and the ingenuity of your project. We‰Ûªd love to welcome you to Microso‰Û_ https://t.co/QiLCkLbxpe"
RT @yusuf_i_mehdi: Time is our most precious commodity. Get more of it with the new Windows 10 Update. Free download starts April 30th.  #W‰Û_
"RT @BradSmi: The attacks from the past year demonstrate that cybersecurity is not just about what any single company can do alone, but what‰Û_"
"Security underpins our approach to the intelligent cloud and intelligent edge. Announcing Azure Sphere, designed to‰Û_ https://t.co/9vMG7sj8ia"
RT @BradSmi: We are in the business of creating software to help our customers digitally transform. That's why we've announced Shared Innov‰Û_
We‰Ûªre investing $5 billion in IoT to help customers in every industry digitally transform with connected solutions‰Û_ https://t.co/oHxPG8dmws
Burton Smith was a true visionary and pioneer in supercomputing. His enthusiasm for asking the big questions and do‰Û_ https://t.co/gZimgEXdh4
"On behalf of all of Microsoft, our hearts are with everyone at YouTube and Google today and all those affected. https://t.co/dijMxGXGpD"
Inclusive teams that value diverse perspectives and inclusive design principles will have the deepest impact in bui‰Û_ https://t.co/B94ihrmEFR
"@tmyerson @Microsoft @BillGates @Steven_Ballmer Terry, I‰Ûªve had deep admiration and respect for you and your work s‰Û_ https://t.co/QKvOkzhK5a"
Linda Brown and her family showed courage and strength in taking a stand against injustice. She will forever have a‰Û_ https://t.co/Y6aiSNX2af
"News for our Dynamics 365 and Business Applications platform to empower organizations' digital transformation, and‰Û_ https://t.co/R67wqtQkHb"
RT @TechCrunch: Teacher in Ghana who used blackboard to explain computers gets some Microsoft love https://t.co/mM3fIlXiVr https://t.co/FV1‰Û_
"Expanding our cloud services in Europe and the Middle East. We‰Ûªre focused on delivering a comprehensive, intelligen‰Û_ https://t.co/UmXaqAKcI7"
We lost a great one today. Stephen Hawking will be remembered for his incredible contributions to science ‰ÛÒ making‰Û_ https://t.co/V8jikPcRKY
We‰Ûªre excited to see how customers like General Motors are making Microsoft Teams their hub for teamwork and today‰Û_ https://t.co/2TUrVPgyo8
"A look at what‰Ûªs coming to the next Windows 10 update for developers to build AI apps and experiences, modernize th‰Û_ https://t.co/tQOjCEPMPd"
Today we celebrate the incredible contributions of women around the world and press for progress to create more equ‰Û_ https://t.co/vmHlbWnJUy
"We have the most trusted, comprehensive cloud for government that more than 10 million government users rely on. To‰Û_ https://t.co/zE7cdSy37S"
RT @akipman: Such cool innovation from @RenaultSportF1.  Love their use of #HoloLens and #MixedReality https://t.co/uBtTTrJ9iW
